doc_name,query,num_answer,answer
30. 2021+임상시험+관련+자주묻는+질의응답.txt,"q43 신규 관리약사 등에 대한 교육
 신규 관리약사 등에 대한 임상시험 관련 교육을 반드시 시험책임자나 모니터요원이
 교육을 해야 하는지?
",2,"['○ 임상시험실시기관의 장이 임상시험용의약품 관리약사를 지정하여 운영토록 하고 있\n 으며, 관리약사에 대해 교육할 수 있는 자를 임상시험책임자 등으로 한정하고 있지는\n 않습니다.\n - 따라서 해당 임상시험에 대해 충분한 지식 등을 갖춘 관리약사가 신규 관리약사에 대해\n 교육하는 것도 가능할 것입니다.\n', '○ 아울러, 「의약품 등의 안전에 관한 규칙」 [별표 4] 제3호아목에 따라 임상시험 수행에\n 참여하는 모든 사람들은 각자의 업무 수행에 필요한 적절한 교육과 훈련을 받고 해당\n 업무 분야와 관련한 경험을 갖고 있어야 하며.\n - 임상시험의뢰자는 임상시험의 특성을 고려하여 신규 관리약사가 해당 임상시험용의\n 약품을 적절하게 관리할 수 있도록 교육과 훈련을 받도록 하는 등 그에 따른 품질\n 관리체계를 확보하여야 합니다.\n 8 임상시험 이상약물반응보고 및 안전성정보 보고\n']"
30. 2021+임상시험+관련+자주묻는+질의응답.txt,"q44 임상시험 이상반응 보고 대상
 의약품 임상시험 이상반응의 보고 대상
",1,"['○ 「의약품 등의 안전에 관한 규칙」 [별표 4]의 제8호러목에 따르면,\n - 의약품의 경우, 의뢰자(연구자 임상시험의 경우 연구자)는 시험자, irb(시험책임자가\n irb에 보고하지 않았거나 보고한 사항을 변경할 필요가 있는 경우만 해당한다) 및\n 식약처장에게 중대하고 예상하지 못한 모든 이상약물반응(susar, suspected\n unexpected serious adverse drug reaction)을 보고하여야 합니다.\n - “중대한 이상약물반응”이란 임상시험용 의약품의 임의 용량에서 발생한 이상약물반응\n 중에서 다음 어느 하나에 해당하는 경우입니다.\n 1. 사망하거나 생명에 대한 위험이 발생한 경우\n 2. 입원할 필요가 있거나 입원 기간을 연장할 필요가 있는 경우\n 3. 영구적이거나 중대한 장애 및 기능 저하를 가져온 경우\n 4. 태아에게 기형 또는 이상이 발생한 경우\n - 다만, 환자를 위태롭게 하거나 중대한 이상반응에 해당하는 증상이 발생되지 못하도록\n 조치가 필요한 기타 중대한 의학적 사건의 경우 보고하여야 합니다.\n 예) 알레르기성 기관지 수축으로 인한 집이나 병원 응급실에서의 집중 치료, 혈액 질환\n 이나 입원을 초래하지 않는 발작, 약물 의존성 또는 약물 남용으로 발전되는 경우\n']"
30. 2021+임상시험+관련+자주묻는+질의응답.txt,"q45 대조약 또는 위약의 susar
 대조약 또는 위약의 susar 발생 시 보고해야 하나요?
",1,"['○ 대조약은 임상시험용 의약품으로, 대조약에 의한 susar 발생한 경우에는 시험약과\n 동일하게 기한 내에 식약처로 보고하여야 합니다.\n - 다만, 위약에 관련된 susar는 보고할 의무는 없습니다.\n']"
30. 2021+임상시험+관련+자주묻는+질의응답.txt,"q46 약물이상반응 보고 기한
 이상반응의 보고 시기
",1,"['○ 「의약품 등의 안전에 관한 규칙」 [별표 4]의 제8호러목에 따르면,\n - 의약품의 경우, 의뢰자(연구자 임상시험의 경우 연구자)는 시험자, irb(시험책임자가\n irb에 보고하지 않았거나 보고한 사항을 변경할 필요가 있는 경우만 해당한다) 및\n 식약처장에게 중대하고 예상하지 못한 모든 이상약물반응을 다음의 구분에 따른 기\n 한 내에 보고하여야 합니다.\n 1. 사망을 초래하거나 생명을 위협하는 경우 : 의뢰자가 해당 사실을 보고받거나 알게\n 된 날부터 7일 이내(이 경우 의뢰자는 이상약품반응에 대한 상세한 정보를 최초\n 보고일로부터 8일 이내에 추가로 보고하여야 함)\n 2. 그 밖의 중대하고 예상하지 못한 이상약물반응의 경우 : 의뢰자가 해당 사실을 보고\n 받거나 알게 된 날부터 15일 이내\n']"
30. 2021+임상시험+관련+자주묻는+질의응답.txt,"q47 약물이상반응보고 종료시점
 약물이상반응 보고의 종료시점
",2,"['○ 의뢰자의 임상시험 중 이상약물반응 및 안전성보고의 기간은 해당 이상약물반응의\n 소실이 장기화 될 경우, 의뢰자의 이상약물반응 보고의 추적조사 관리가 어려운 점을\n 감안하여, 일반적으로 임상시험의 완료(임상시험계획서가 정한 국내 및 다국가 임상\n 시험 대상자의 추적관찰기간을 포함)시점까지는 보고하는 것이 일반적인 것으로 볼\n 수 있습니다.\n', '○ 다만, 국내 임상시험 종료 이후라도 시험자에 의해 중대하고 예상하지 못한 이상약\n 물반응이 임상시험 대상자의 안전 관련 신속보고 사항으로 보고될 경우, 의뢰자는\n 인과관계의 평가 등을 통해 신속보고 여부를 결정하여 식약처에 보고하여야 될 것\n 으로 판단됩니다.\n']"
30. 2021+임상시험+관련+자주묻는+질의응답.txt,"q48 임상시험 안전성 신속보고 대상
 의약품의 임상시험 중 신속히 보고되어야 할 안전성 정보
",1,"['○ 「의약품 등의 안전에 관한 규칙」 [별표 4] 제8호더목에 따라\n - 의뢰자는 임상시험용 의약품의 안전성에 대한 평가를 지속적으로 실시하여야 하며,\n - 임상시험 대상자의 안전을 위협하거나, 임상시험의 실시여부에 영향을 미치거나,\n irb의 결정사항을 변경해야할 만한 임상시험용 의약품의 안전성에 관한 정보를 취\n 득한 경우에도 시험자 및 식약처장에게 이를 신속히 보고하여야 합니다.\n - 구체적인 의약품 임상시험 안전성 정보 신속보고 대상 등은 “의약품 임상시험 의뢰\n 자의 안전성 평가 및 보고 시 고려사항(민원인 안내서)”를 참고하시기 바랍니다.\n']"
30. 2021+임상시험+관련+자주묻는+질의응답.txt,"q49 중대한 약물이상반응(sae) 발생 시점
",2,"['a라는 증상으로 입원했을 때 sae 발생 시점은 a 증상이 발생한 시기와 입원한 시기 중\n 언제로 판단하여 보고해야 하나요?\n', '○ 「의약품 등의 안전에 관한 규칙」 [별표 4] 제2호하목에서는 중대한 이상반응·약물이상\n 반응(serious ae·adr)을 임상시험용 의약품의 임의 용량에서 발생한 이상반응 또는\n 이상약물반응 중에서 다음의 어느 하나에 해당하는 경우로 정하고 있습니다.\n - 따라서, 중대한 이상반응의 시작일은 시험책임자가 해당 이상반응이 다음의 경우에\n 해당되어 중대하다고 판단한 날(예: 입원일 등)을 기준으로 하실 수 있습니다.\n 1) 사망하거나 생명에 대한 위험이 발생한 경우\n 2) 입원할 필요가 있거나 입원 기간을 연장할 필요가 있는 경우\n 3) 영구적이거나 중대한 장애 및 기능 저하를 가져온 경우\n 4) 태아에게 기형 또는 이상이 발생한 경우\n 5) 1)부터 4)까지의 사례 외에 약물 의존성이나 남용의 발생 또는 혈액질환 등 그\n 밖에 의학적으로 중요한 상황이 발생하는 사례\n']"
30. 2021+임상시험+관련+자주묻는+질의응답.txt,"q50 안전성정보의 의학적 평가자 자격
 '의약품 임상시험 안전성 정보관리 방법' 관련 의뢰자의 의학적 평가가 가능한 평가자는?
",1,['○ 의학적 평가자는 의학적 지식과 관련경험을 갖춘 자로서 임상의사가 적합할 것으로\n 판단됩니다.\n']
30. 2021+임상시험+관련+자주묻는+질의응답.txt,"q51 약물이상반응과 임상시험약의 인과관계 평가
 '의약품 임상시험 의뢰자의 안전성 정보 평가 시,
 1) 인과관계 평가 시, ‘unassessable‘의 ""관련성 있음""으로 구분 할 수 있나요?
 2) 약물이상반응과 임상약의 연관성에 대해 시험자는 인과관계가 있다고 판단하나,
 의뢰자의 인과관계 평가와 다른 경우 판단은 어떻게 해야 하나요?
",2,"['○ 의뢰자는 「의약품 등의 안전에 관한 규칙」별지 제77호 서식 중 약물이상반응과\n 의심되는 약물과의 관계를 ""관련성이 있음"" 또는 ""관련성이 없음""으로 구분하여\n 보고하기 위해 사전에 관련성에 대한 분류 기준 등을 명확히 정하여 관리해야 합니다.\n - 예를 들어 관련성 분류는 certain, probable, possible, unassessable은 ""관련성이\n 있음""으로, unlikely는 ""관련성 없음""으로 분류하여 평가될 수 있습니다.\n', '○ 인과관계 평가 시 시험자와 의뢰자의 의견이 다른 경우, 어느 한쪽이라도 의심되는\n 약물이상반응이라고 평가하였을 때 인과관계가 있는 것으로 결정하시면 됩니다.\n']"
30. 2021+임상시험+관련+자주묻는+질의응답.txt,"q52 임상시험계획서에 따른 입원검사의 중대한 약물이상반응(sae) 판단 여부
 임상시험계획서에 따라 입원검사를 하는 임상시험의 경우와 같이 의학적이지 않은
 이유로 입원하여 진행하게 되면 이것을 반드시 sae로 보아야 하나요?
",1,['○ ‘의학적으로는 sae가 아닌데 환자가 편의를 위해 입원을 원하는 경우’는 임상시험용\n 의약품의 중대한 이상반응 대상에서 제외할 수 있습니다.\n']
30. 2021+임상시험+관련+자주묻는+질의응답.txt,"q53 susar 보고업무의 cro 위탁 가능 여부
 의뢰자는 임상시험 중 발생한 중대하고 예상하지 못한 모든 약물이상반응(susar)을
 식약처장에게 보고하여야 하는데 해당 업무를 cro에 위탁하여 진행할 수 있나요?
",1,"['○ 국내에서 임상시험계획승인을 받은 자가 임상시험 중 발생한 안전성정보 보고 관련\n 업무를 타 기관에 위탁하여 진행 가능하나, 약사법령이 정한 안전성 보고기한 준수\n 등 모든 관리 책임은 임상시험계획승인을 받은 자에게 있습니다.\n']"
30. 2021+임상시험+관련+자주묻는+질의응답.txt,"q54 해외 susar 보고 대상 여부
 국내 임상시험에서 사용하는 임상시험용의약품(ip)과 동일한 ip로 진행되는 해외 임상
 시험(다른 protocol)에서 수집된 susar에 대해서도 보고해야하나요?
",1,"['○ 「약사법」제34조, 「의약품 등의 안전에 관한 규칙」 제30조제1항제13호에 따라 임상시험\n 계획승인을 받은 자는 중대하고 예상하지 못한 약물이상반응이 발생한 경우에는 별표 4의\n 의약품임상시험관리기준 제8호러목에 따라 식약처장에게 보고하여야 합니다.\n - 국내에서 승인받은 임상시험계획서에서 사용되는 임상시험용의약품으로 해외에서\n 진행되는 다른 임상시험계획서에서 발생한 중대하고 예상하지 못한 약물이상반응\n 개별보고(susar)는 위 규정에 따른 식약처 보고대상에 해당되지 않습니다.\n - 다만, 동일한 임상시험용 의약품으로 임상시험(치료목적 사용 포함)을 사용하고 있는\n 연구자(의료인)에게 해당 정보를 신속히 제공하여 대상자 안전 조치를 취할 수 있도록\n 하는 것이 바람직합니다.\n']"
30. 2021+임상시험+관련+자주묻는+질의응답.txt,"q55 식약처 승인 전 해외 발생 susar의 보고 대상 여부
 허가용 다국가 임상시험 진행 시 식약처 승인 전 해외 발생한 susar 보고해야 하나요?
",1,"['○ 중대하고 예상하지 못한 약물이상반응의 보고기간은 초회 보고를 기준으로 할 때,\n 식약처장으로부터 해당 임상시험계획의 승인을 받은 날부터 종료 보고 시까지 보고\n 하는 것을 원칙으로 하고 있습니다. 따라서, 해당 임상시험계획서의 식약처 승인일\n 이전에 해외에서 발생한 susar는 식약처 보고대상에 해당되지 않습니다.\n 9 임상시험 기본문서 관리\n']"
30. 2021+임상시험+관련+자주묻는+질의응답.txt,"q56 기본문서 관리
 임상시험 실시에 필요한 기본문서
",2,"['○ 임상시험 기본 문서는 시험의 수행과 그로부터 얻어진 자료의 질에 대해 개별적 또는\n 전체적인 평가가 가능하도록 해주는 문서를 의미합니다.\n', '○ 임상시험 기본문서는 「국제의약품규제조화위원회 임상시험관리기준(ich gcp)」 민원\n 인 안내서(‘20.7.22.)를 참고하시기 바랍니다.\n']"
30. 2021+임상시험+관련+자주묻는+질의응답.txt,"q57 의뢰자의 임상시험 관련 문서 보관 책임
 의뢰자도 임상시험 문서 보관을 위한 보관책임자를 지정해야 하는지
",3,"['○ 의뢰자는 「의약품 등의 안전에 관한 규칙」 [별표 4] 제8호사목1) 및 제9호, 의약품 임\n 상시험 기본문서 관리에 관한 규정에 따라 기본문서 및 그 밖의 자료를 보관하여야 하\n 나, 의뢰자가 별도로 보관책임자를 정하도록 규정하고 있지는 아니합니다.\n', '○ 다만, 의약품 임상시험 기본문서 관리에 관한 규정 제3조제2항에 따라, 의뢰자 기본\n 문서를 보관하는 장소를 따로 준비하고, 이들 문서가 사고 등에 의해 조기에 파손\n 또는 분실되지 않도록 하여야 하므로, 의뢰자의 임상시험 관련 sop에 임상시험 기본\n 문서를 보관 및 관리하는 절차를 마련하고 이에 따라 보관 및 관리하는 것이 바람직\n 할 것이며, 책임소재를 분명하게 하기 위하여 보관책임자를 정하여 문서화하는 방법\n 도 바람직합니다.\n', '○ 참고로, 임상시험 실시기관의 경우, 「의약품 등의 안전에 관한 규칙」 [별표 4] 제5호\n 나목8)에 따라 임상시험실시기관의 장이 보관책임자를 정하여 제6호가목13) 및 제7\n 호자목6)에 따라 irb 및 시험책임자로부터 인계받은 기록 및 자료를 보관하도록 하\n 여야 합니다.\n']"
30. 2021+임상시험+관련+자주묻는+질의응답.txt,"q58 임상시험 기본문서 보존기간
 임상시험 실시 관련 자료(전자문서를 포함) 보존을 위한 임상시험 완료일 기준
",2,"['○ 「의약품 등의 안전에 관한 규칙」 제30조제1항제12호에 따라 임상시험 계획서, 임상\n 시험용 의약품 등의 제조 및 관리에 관한 기록 등 임상시험 실시와 관련된 각종 자료\n (전자문서를 포함한다)를 아래와 같이 보존하여야 합니다.\n 1. 해당 임상시험용 의약품등의 품목(변경)허가를 위한 임상시험 관련자료 : 품목 허가일부터 3년간\n 2. 가목의 자료 외의 임상시험 관련 자료 : 임상시험의 완료일부터 3년간\n', '○ 임상시험 완료일은 「의약품 등의 안전에 관한 규칙」 [별표 4] 제7호파목에 따라 ‘시\n 험책임자가 임상시험결과를 요약한 자료를 첨부하여 심사위원회에 임상시험 완료\n 사실을 보고한 날‘로 볼 수 있습니다.\n']"
30. 2021+임상시험+관련+자주묻는+질의응답.txt,"q59 임상시험심사위원회(irb) 문서의 이관 관리
 임상시험심사위원회(irb) 문서를 임상시험 문서보관실에 이관하여 관리하여도 되나요?
",2,"['○ 「의약품 등의 안전에 관한 규칙」 [별표 4] 제5호나목8)에 따라 임상시험실시기관의 장은\n 제6호가목13) 및 제7호자목6)에 따라 심사위원회 및 시험책임자로부터 인계받은 기록\n 및 자료를 보관책임자를 정하여 보관하도록 정하고 있으며 문서보관실로 인계된 이\n 후에는 임상시험실시기관의 장에게 임상시험 관련 문서의 보관 책임이 있습니다.\n - 임상시험문서, irb문서, 임상연구 관련 문서 등을 임상시험 문서보관실에 함께 보관하는\n 것은 가능하나, 이 경우 문서의 보관은 문서 관리에 관한 권한을 위임받은 사람에 한해\n 접근할 수 있도록 적절한 잠금장치가 된 장소 또는 설비 등에 보관하여야 합니다.\n', '○ 따라서, 임상시험실시기관의 장은 문서보관 장소의 출입기준 등 보안 체계 확립, 보관\n 책임자의 명확한 역할과 의무, 해당 문서의 적절한 관리 절차(이관, 보관, 열람, 폐기\n 등)를 마련하는 등 임상시험 문서의 기밀 등을 보장하고 임상시험심사위원회 업무의\n 독립성을 보장할 수 있도록 적절한 운영·관리체계를 마련하여 운영하여야 합니다.\n - 또한, 의무기록 등 의료법 등에서 보관 주체 등을 별도로 정하고 있는 임상시험 관련\n 문서의 경우에는 타 법령에 저촉되지 않도록 보관 및 관리하여야 합니다.\n']"
30. 2021+임상시험+관련+자주묻는+질의응답.txt,"q60 임상시험 실시기관의 문서보관실 장소
 의료기관개설허가증 상 소재지 이외의 장소에 문서보관실을 마련이 가능한가요?
",1,"['○ 「약사법」 제34조의2 및 「의약품 등의 안전에 관한 규칙」 제34조에서 임상시험실시\n 기관의 지정요건은 「의료법」에 따른 의료기관으로 정하고 있으므로 임상시험 실시에\n 필요한 시설 등은 의료기관 내에 포함되어 있어야 합니다.\n - 다만, ‘기록 및 자료의 보관실’의 경우 자료가 축적되어 공간 협소 등의 사유로 불\n 가피하게 의료기관 개설허가증의 소재지 이외의 장소에 보관하여야 할 필요성이\n 인정되는 경우에는 외부 문서보관소의 접근제한 등 보안 체계 확립, 보관책임자의\n 명확한 역할과 의무, 해당 문서의 적절한 관리 절차(이관, 보관, 열람, 폐기 등)를\n 마련하고, 해당 시설에 대한 정기적인 점검 실시 및 기록 등을 통해 해당 보관 문서들의\n 유출, 파손 등을 미연에 방지할 수 있도록 하여야 할 것입니다.\n - 이 경우에는 ‘기록 및 자료의 보관실’의 소재지가 의료기관개설허가증의 소재지에\n 포함되어 있지 않더라도 문서의 관리 및 책임소재를 명확히 하기 위하여 예외적으로\n 임상시험실시기관 소재지의 변경지정 신청하여 지정서 소재지에 포함하여야 합니다.\n - 또한, 외부 보관 전문 업체와 계약하여 임상시험 관련 자료 등을 보관하는 경우에는\n 반드시 계약 전에 해당 업체의 문서보관 시설·설비 및 인력, 접근제한 등 보안 체계,\n 문서 관리 절차 등을 평가하여야 하며, 적합할 경우 실시기관의 보관책임자와 보관\n 업체 관리자 간의 명확한 업무와 책임, 실시기관와 전문업체 간의 적절한 문서 관리\n 절차(이관, 보관, 열람, 폐기 등) 등을 표준작업지침서 등에 별도로 마련하고, 해당\n 시설에 대한 정기적인 점검 실시 및 기록 등 하여야 하며, 이 때 임상시험 관련 자료에\n 대한 관련 법령상의 최종 책임은 실시기관의 장에게 있습니다.\n']"
30. 2021+임상시험+관련+자주묻는+질의응답.txt,"q61 근거문서 및 증례기록서 기록 관리
 임상시험 대상자의 이상반응, 질병력 등 일부 정보가 다른 근거문서에서 확인되지 않는
 경우 워크시트만으로 근거문서로써 인정받을 수 있는지? 임상시험 근거문서 없이 증례
 기록서에만 기록 관리 할 수 있는지?
",2,"['○ 워크시트에 기재한 임상시험대상자에 대한 기록도 근거문서에 포함하여 관리할\n 수 있으나 임상시험이 요구하는 특정 예외사항으로 한정하여야 하며, 특히 시험\n 참여 환자의 이상반응, 질병력 등은 향후 시험 참여 환자 진료에 중대한 영향을\n 미칠 수 있는 사항은 의무기록에 포함하여 관리하는 것이 바람직합니다.\n - 또한, 워크시트 등을 포함한 임상시험 근거문서는 해당 임상시험 특성을 고려하여\n 임상시험실시기관과 합의하여 결정하고 임상시험의 신뢰성을 보증할 수 있도록\n 적절하게 관리하여야 합니다.\n', '○ 아울러, 임상시험 근거문서 없이 “증례기록서”에만 기록·관리하는 것은 적절하지\n 않을 것으로 사료됩니다.\n']"
30. 2021+임상시험+관련+자주묻는+질의응답.txt,"q62 워크시트(worksheet) 기록 및 보관
 워크시트(worksheet)의 기록 및 보관에 대한 별도 지침이 있는지
",1,"['○ 워크시트의 기록에 대하여 별도로 규정은 없으나, 워크시트에 시험책임자가 의뢰자\n 에게 보고하는 증례기록서나 다른 모든 보고서에 포함될 내용의 근거가 되는 자료\n 가 기록되어 있다면, 임상시험에서 얻어진 자료의 정확성을 증명할 수 있도록 정확\n 하고, 완전하며, 최신사항이 반영되도록 기록·유지되어야 하며, 임상시험 기본문서와\n 동일하게 보관하여야 합니다.\n']"
30. 2021+임상시험+관련+자주묻는+질의응답.txt,"q63 대상자 선별기록 및 등재기록의 문서 관리
 ecrf 또는 iwrs(interactive web response system)를 이용하여 대상자의 선별기록
 (screening log) 및 등재기록(enrollment log)을 관리하는 경우, 연구자파일(investigator
 study file)에 별도의 종이문서로 보관해야 하는지?
",1,"['○ 「의약품 등의 안전에 관한 규칙」 제30조에 따라 임상시험의뢰자 및 임상시험실시\n 기관 등에서는 임상시험 관련 자료의 원본 및 사본을 보관·관리하여야 합니다.\n - 다만, 임상시험의뢰자가 웹사이트 등를 통해 전자증례기록서 등을 관리하는 경우\n 임상시험의뢰자 및 임상시험실시기관(시험자 포함)이 관리 가능하고 지속적으로\n 접근할 수 있도록 하여야 하며, 문서 보관 기간 동안 해당 문서의 확인·보관 관리\n 책임에 문제가 없도록 하여야 합니다.\n - 대상자의 선별(screening log) 및 등재 기록(enrollment log)이 작성 목적에 부합\n 하게 기록·보관 관리될 수 있는 경우에는 전자자료로도 관리 가능하며, 이 기록을\n 중복해서 수기로 관리할 필요는 없습니다.\n']"
30. 2021+임상시험+관련+자주묻는+질의응답.txt,"q64 종사자 교육 수료증 사본 보관
 연구자 기본문서(investigator study file)에 임상시험에 참여하는 시험책임자 및 시험
 담당자 등의 임상시험 종사자 교육 수료증 사본을 보관해야 하는지?
",2,"['○ 의뢰자 및 시험기관/시험책임자는 (새로 참여하는)시험자의 자격을 증명하는 이력\n 서와 기타 관련 문서를 임상시험 실시 전과 실시 중에 보관하여야 합니다.\n', '○ 따라서, 의뢰자는 국내 규정에 따라 임상시험책임자 등의 임상시험 종사자 교육\n 수료를 확인하고 그 문서를 기본 문서로 보관하여야 합니다.\n - 다만, 임상시험실시기관에서 임상시험종사자에 대한 교육 관리를 위해 기관 표준\n 작업지침서(sop)에 따라 수료증 사본 등을 보관하고 있고, 의뢰자가 모니터링 중\n 종사자 교육 이수에 대해 적절히 확인할 수 있는 절차가 있는 경우에는 의뢰자의\n 기본문서로 별도 보관하지 아니하여도 됩니다.\n 10 임상시험 종사자 교육\n']"
30. 2021+임상시험+관련+자주묻는+질의응답.txt,"q65 종사자교육 이수대상자 및 과정
 2021.11.29. 개정된 고시와 관련하여, 의약품임상시험에서 채혈 또는 투약 업무만을 수행
 하는 경우나 임상병리사, 방사선사의 경우, 종사자 교육 중 어떤 교육을 이수하여야 하는지
",1,"['○ 「의약품 임상시험 등 종사자 교육 및 교육실시기관 지정에 관한 규정」(식약처고시)\n [별표1] ‘1. 교육과정 및 연간이수시간’에서 정하는 자에 해당하지 않으므로, 의약품\n 임상시험 종사자 교육대상에 해당하지 않습니다.\n - 다만 이 경우에도 「의약품 등의 안전에 관한 규칙」 [별표 4] 제3호아목에 따라\n 임상시험 수행에 참여하는 모든 사람들은 각자의 업무 수행에 필요한 적절한 교육과\n 훈련을 받도록 자체적인 관리가 필요합니다.\n ※ 상기 개정 고시의 시행일은 2022. 1. 1.입니다.\n']"
